{
  "description": "Behave para Entender al Usuario",
  "duration": 1297,
  "language": "eng",
  "recorded": "2020-11-16",
  "related_urls": [
    {
      "label": "Conference Website",
      "url": "https://eventos.python.org.ar/events/pyconar2020/"
    }
  ],
  "speakers": [
    "Mar√≠a Camila Guerrero Giraldo"
  ],
  "tags": [],
  "thumbnail_url": "https://i.ytimg.com/vi/Ks7eLJJJhkk/maxresdefault.jpg",
  "title": "Behave para Entender al Usuario",
  "videos": [
    {
      "type": "youtube",
      "url": "https://www.youtube.com/watch?v=Ks7eLJJJhkk"
    }
  ]
}
