{
  "description": "[EuroPython 2024 \u2014 South Hall 2B on 2024-07-11]\n\n\rAn alternative view on the OpenAPI documentation. by Maxim Danilov\n\rhttps://ep2024.europython.eu/session/an-alternative-view-on-the-openapi-documentation\n\n\rDocumenting Python project endpoints is a real challenge in API development. Poor readability, versioning, and lack of authentication information - this all reduce the usability of existing OpenAPI documentation. The different libraries offers us a good start for autogenerated OpenAPI documentation for our endpoints, but in this talk we will discuss an alternative way to auto generated documentation for our APIs.\n\n\n\r---\n\rThis work is licensed under a Creative Commons Attribution-NonCommercial-ShareAlike 4.0 International License: https://creativecommons.org/licenses/by-nc-sa/4.0/",
  "duration": 1872,
  "language": "eng",
  "recorded": "2024-07-08",
  "related_urls": [
    {
      "label": "Conference Website",
      "url": "https://ep2024.europython.eu/"
    },
    {
      "label": "https://ep2024.europython.eu/session/an-alternative-view-on-the-openapi-documentation",
      "url": "https://ep2024.europython.eu/session/an-alternative-view-on-the-openapi-documentation"
    },
    {
      "label": "https://creativecommons.org/licenses/by-nc-sa/4.0/",
      "url": "https://creativecommons.org/licenses/by-nc-sa/4.0/"
    }
  ],
  "speakers": [
    "Maxim Danilov"
  ],
  "tags": [],
  "thumbnail_url": "https://i.ytimg.com/vi/EJ0rJ8TMmqU/maxresdefault.jpg",
  "title": "An alternative view on the OpenAPI documentation.",
  "videos": [
    {
      "type": "youtube",
      "url": "https://www.youtube.com/watch?v=EJ0rJ8TMmqU"
    }
  ]
}
