{
  "alias": "video/3156/case-study-using-git-to-manage-ui-derived-config",
  "category": "PyTexas 2014",
  "copyright_text": "CC-BY",
  "description": "Git is common choice for DVCS by software development teams. This case\nstudy describes a python system called ClicBank, that captures domain\nspecific UI entity definitions (in medical insurance industry) as XML\nfiles and manages changes in the configurations using open source Git\nmodules. This case study will describe the use cases driving this\ndesign, design choices, schema approach, implementation decisions,\npython modules, workspace/repository design, number of managed entities,\nGIT performance and status of project.\n",
  "duration": 3000,
  "id": 3156,
  "language": "eng",
  "quality_notes": "",
  "recorded": "2014-10-04",
  "slug": "case-study-using-git-to-manage-ui-derived-config",
  "speakers": [
    "Doug Matzke"
  ],
  "summary": "",
  "tags": [],
  "thumbnail_url": "https://archive.org/services/img/pyvideo_3156___Case_Study_Using_Git_to_manage_UI_derived_configur",
  "title": "Case Study: Using Git to manage UI derived configuration Elements",
  "videos": [
    {
      "type": "archive.org",
      "url": "https://archive.org/details/pyvideo_3156___Case_Study_Using_Git_to_manage_UI_derived_configur"
    },
    {
      "length": null,
      "type": "mp4",
      "url": "http://64966d3674e0a64d8f4a-47c94b14ef8e1f83d5390cdb0629c6ed.r53.cf2.rackcdn.com/pytexas-2014/3156_Case_Study_Using_Git_to_manage_UI_derived_configur.mp4"
    },
    {
      "length": 0,
      "type": "youtube",
      "url": "http://youtu.be/48fcIml0-_Y"
    }
  ]
}
