{
  "description": "Full talk title: \"How to Build Your First Real-Time Voice Agent in Python (Without Losing Your Mind)\"\n\nVoice agents powered by LLMs look amazing in demos\u2026 until you try to build one yourself and the problems start: slow responses, overlapping audio, and a bot that either hallucinates non-stop or falls into eternal silence. In this talk, I\u2019ll share how I built an \u201cEnglish Speaking Buddy\u201d voice agent: an English tutor you can talk to, that adapts to your level and helps you lose the fear of speaking. It\u2019s built with Python, AWS services (for speech and LLM), and Pipecat, an open source Python framework for creating real-time conversational voice agents. We\u2019ll walk through the core pipeline audio \u2192 text \u2192 LLM \u2192 audio, and how to build a clear, maintainable architecture for real-time voice agents. We\u2019ll also look at the less glamorous but critical parts that make this actually work: handling errors, configuring and protecting API keys, logging what\u2019s going on, and making good design decisions so the conversation with the bot feels natural. Even though the examples use AWS and Pipecat, the patterns we\u2019ll discuss can be applied with other providers and libraries. You\u2019ll leave with a clear mental model of how these agents work, concrete Python code examples you can adapt to your own projects, and a small checklist to turn a demo into something people can actually talk to.",
  "duration": 1614,
  "language": "eng",
  "recorded": "2026-05-15",
  "related_urls": [
    {
      "label": "Conference Website",
      "url": "https://us.pycon.org/2026/"
    },
    {
      "label": "Presentation Webpage",
      "url": "https://us.pycon.org/2026/schedule/presentation/101/"
    }
  ],
  "speakers": [
    "Camila Hinojosa A\u00f1ez",
    "Elizabeth Fuentes"
  ],
  "thumbnail_url": "https://i.ytimg.com/vi/6NY44ciOjRQ/hqdefault.jpg",
  "title": "How to Build Your First Real-Time Voice Agent in Python (Without Losing Your Mind)",
  "videos": [
    {
      "type": "youtube",
      "url": "https://www.youtube.com/watch?v=6NY44ciOjRQ"
    }
  ]
}
