{
  "description": "The title \u201cData Scientist\u201d has been in use for 15 years now. We have been attending PyData conferences for over 10 years as well. The hype around data science and AI seems higher than ever before. But How are we managing?\n\nhttps://speakerdeck.com/noatmair/how-are-we-managing-data-teams-management-irl",
  "duration": 2765,
  "language": "eng",
  "recorded": "2023-04-17",
  "related_urls": [
    {
      "label": "Conference Website",
      "url": "https://2023.pycon.de/"
    },
    {
      "label": "https://speakerdeck.com/noatmair/how-are-we-managing-data-teams-management-irl",
      "url": "https://speakerdeck.com/noatmair/how-are-we-managing-data-teams-management-irl"
    }
  ],
  "speakers": [
    "TODO"
  ],
  "tags": [
    "Education",
    "Julia",
    "NumFOCUS",
    "Opensource",
    "PyData",
    "Python",
    "Tutorial",
    "coding",
    "how to program",
    "learn",
    "learn to code",
    "python 3",
    "scientific programming",
    "software"
  ],
  "thumbnail_url": "https://i.ytimg.com/vi/5oBMxhdO-Us/maxresdefault.jpg",
  "title": "Noa Tamir:  How Are We Managing? Data Teams Management IRL",
  "videos": [
    {
      "type": "youtube",
      "url": "https://www.youtube.com/watch?v=5oBMxhdO-Us"
    }
  ]
}
