{
  "description": "Esta es una continuaci\u00f3n de la charla https://pybaq.co/eventos/2024-09-05-integra-un-asistente-personal-de-ia-generativa-en-tus-apps-sin-ser-un-experto/\r\n\r\nEn esta sesi\u00f3n veremos como integrar asistentes personales generados por IA de forma f\u00e1cil en tus aplicaciones en Python, sin necesidad de experiencia previa, y como integrarlo a cualquier aplicaci\u00f3n a trav\u00e9s de APIs.\r\n\r\nNivel: Intermedio\r\nPonente: Elizbeth Fuentes\r\n\r\nEn mi rol de Especialista en An\u00e1lisis de Datos y Aprendizaje Autom\u00e1tico/Inteligencia Artificial (ML/AI), mi misi\u00f3n es simplificar conceptos complejos, traduci\u00e9ndolos a un lenguaje accesible para todos. Me dedico a crear soluciones innovadoras que enfrentan de forma eficaz los retos que surgen en el mundo real. A trav\u00e9s de mi participaci\u00f3n en conferencias y la creaci\u00f3n de recursos educativos, busco compartir mis conocimientos y experiencias con el fin de empoderar a los desarrolladores, ayud\u00e1ndoles a expandir sus habilidades y alcanzar sus objetivos profesionales.\n\nM\u00e1s info en https://pybaq.co/eventos/2024-10-09-integra-un-asistente-personal-de-ia-generativa-en-apps-sin-ser-experto-parte-2/",
  "duration": 3569,
  "language": "eng",
  "recorded": "2024-10-10",
  "related_urls": [
    {
      "label": "Website",
      "url": "https://pybaq.co/"
    },
    {
      "label": "https://pybaq.co/eventos/2024-09-05-integra-un-asistente-personal-de-ia-generativa-en-tus-apps-sin-ser-un-experto/\r",
      "url": "https://pybaq.co/eventos/2024-09-05-integra-un-asistente-personal-de-ia-generativa-en-tus-apps-sin-ser-un-experto/\r"
    },
    {
      "label": "https://pybaq.co/eventos/2024-10-09-integra-un-asistente-personal-de-ia-generativa-en-apps-sin-ser-experto-parte-2/",
      "url": "https://pybaq.co/eventos/2024-10-09-integra-un-asistente-personal-de-ia-generativa-en-apps-sin-ser-experto-parte-2/"
    }
  ],
  "speakers": [
    "TODO"
  ],
  "tags": [],
  "thumbnail_url": "https://i.ytimg.com/vi/I75sSA_KXsA/sddefault.jpg?v=66e850fa",
  "title": "Integra un asistente personal de IA generativa en tus apps sin ser un experto: Parte 2",
  "videos": [
    {
      "type": "youtube",
      "url": "https://www.youtube.com/watch?v=I75sSA_KXsA"
    }
  ]
}
