{
  "category": "DjangoCon 2015",
  "copyright_text": "",
  "description": "",
  "duration": 1717,
  "id": 4867,
  "language": "eng",
  "quality_notes": "",
  "recorded": "2015-09-21",
  "related_urls": [
    "http://amara.org/v/HH7a/"
  ],
  "slug": "wagtail-yet-another-django-cms-by-tom-dyson",
  "speakers": [
    "Tom Dyson"
  ],
  "summary": "Wagtail - Yet Another Django CMS by Tom Dyson\n\nWagtail was launched in February 2014, shortly after its first\nimplementation for the Royal College of Art. It has been\nenthusiastically received by Django developers around the world, and now\npowers sites for small businesses, UN agencies, and global brands in\ntech, political and entertainment sectors. Tom will explain why his\nagency decided to build a new CMS, share some lessons learned in running\na growing open source project, and outline Wagtail's roadmap to version\n2 and beyond.\n\nHelp us caption & translate this video!\n\nhttp://amara.org/v/HH7a/\n",
  "tags": [],
  "thumbnail_url": "https://i.ytimg.com/vi/6j0NVq6g4FE/maxresdefault.jpg",
  "title": "Wagtail - Yet Another Django CMS",
  "videos": [
    {
      "length": 0,
      "type": "youtube",
      "url": "https://www.youtube.com/watch?v=6j0NVq6g4FE"
    }
  ]
}