{
  "copyright_text": "CC BY",
  "description": "Naomi Ceder earned a Ph.D in Classics several decades ago, but switched from ancient human languages to computer languages sometime in the last century. Since 2001, she has been learning, teaching, writing about, and using Python.\n\nShe has attended every PyCon since the first one in 2003 and was one of the originators of the Poster Session, the Education Summit, the Intro to Sprints sessions, the PyCon Charlas, and the Hatchery.\n\nAn elected fellow of the Python Software Foundation, Naomi is the immediate past chair of its board of directors. She is also co-founder of Trans*Code and speaks internationally about Python as well as community, inclusion, and diversity in technology in general.\n\nThe author of The Quick Python Book and the Explore Python Fundamentals project series, she has also done corporate training in Python. In her spare time she enjoys sketching, knitting, and deep philosophical conversations with her dog.",
  "duration": 2225,
  "language": "eng",
  "recorded": "2022-04-27",
  "related_urls": [
    {
      "label": "Conference schedule",
      "url": "https://us.pycon.org/2022/schedule/"
    },
    {
      "label": "About Keynote Speakers",
      "url": "https://us.pycon.org/2022/about/keynote-speakers/#naomi"
    }
  ],
  "speakers": [
    "Naomi Ceder"
  ],
  "tags": [
    "Keynote"
  ],
  "thumbnail_url": "https://i.ytimg.com/vi/sFmwGQu0cQU/hqdefault.jpg",
  "title": "Naomi Ceder",
  "videos": [
    {
      "length": 2225,
      "type": "youtube",
      "url": "https://www.youtube.com/watch?v=sFmwGQu0cQU"
    }
  ]
}
